{
  "company": {
    "name": "NovaCRM, Inc.",
    "period_display": "February 2026",
    "period_code": "2026-02",
    "stage": "Series A",
    "accounting_system": "QuickBooks Online"
  },
  "validation": {
    "timestamp": "2026-03-05T09:14:00Z",
    "row_count": 18,
    "status": "PASS",
    "errors": 0,
    "warnings": 0
  },
  "provenance": {
    "source_system": "QuickBooks Online",
    "gl_export_date": "2026-03-04",
    "budget_source": "Board-approved 2026 annual budget, v2.1",
    "prior_period_checkpoint": "VR-2026-01-0031",
    "coa_template": "coa-template-novaCRM, v1.2",
    "coa_template_hash": "a3f8c1d",
    "analysis_engine": "E-Solutions variance engine v0.1",
    "checkpoint_id": "VR-2026-02-0047"
  },
  "topline": {
    "total_revenue": {
      "actual": 473400.0,
      "budget": 458000.0,
      "variance_dollars": 15400.0,
      "variance_percent": 3.36,
      "signal": "Favorable",
      "prior_period": 436200.0,
      "mom_change_dollars": 37200.0,
      "mom_change_percent": 8.53
    },
    "total_cogs": {
      "actual": 89700.0,
      "budget": 85500.0,
      "variance_dollars": 4200.0,
      "variance_percent": 4.91,
      "signal": "Watch",
      "prior_period": 82800.0,
      "mom_change_dollars": 6900.0,
      "mom_change_percent": 8.33
    },
    "gross_profit": {
      "actual": 383700.0,
      "budget": 372500.0,
      "variance_dollars": 11200.0,
      "variance_percent": 3.01,
      "signal": "Favorable"
    },
    "gross_margin_pct": {
      "actual": 81.05,
      "budget": 81.33,
      "variance_pts": -0.28
    },
    "total_opex": {
      "actual": 352400.0,
      "budget": 342500.0,
      "variance_dollars": 9900.0,
      "variance_percent": 2.89,
      "signal": "Unfavorable",
      "prior_period": 321200.0,
      "mom_change_dollars": 31200.0,
      "mom_change_percent": 9.71
    },
    "operating_income": {
      "actual": 31300.0,
      "budget": 30000.0,
      "variance_dollars": 1300.0,
      "variance_percent": 4.33,
      "signal": "Favorable"
    }
  },
  "line_items": [
    {
      "account_code": "4100",
      "account_name": "SaaS Subscription Revenue",
      "category": "Revenue",
      "actual": 412800.0,
      "budget": 395000.0,
      "variance_dollars": 17800.0,
      "variance_percent": 4.51,
      "is_material": true,
      "signal": "Favorable",
      "prior_period": 378200.0,
      "mom_change_dollars": 34600.0,
      "mom_change_percent": 9.15
    },
    {
      "account_code": "4200",
      "account_name": "Professional Services Revenue",
      "category": "Revenue",
      "actual": 38500.0,
      "budget": 45000.0,
      "variance_dollars": -6500.0,
      "variance_percent": -14.44,
      "is_material": true,
      "signal": "Unfavorable",
      "prior_period": 41200.0,
      "mom_change_dollars": -2700.0,
      "mom_change_percent": -6.55
    },
    {
      "account_code": "4300",
      "account_name": "Usage-Based Revenue",
      "category": "Revenue",
      "actual": 22100.0,
      "budget": 18000.0,
      "variance_dollars": 4100.0,
      "variance_percent": 22.78,
      "is_material": true,
      "signal": "Favorable",
      "prior_period": 16800.0,
      "mom_change_dollars": 5300.0,
      "mom_change_percent": 31.55
    },
    {
      "account_code": "5100",
      "account_name": "Cloud Infrastructure (AWS)",
      "category": "COGS",
      "actual": 52300.0,
      "budget": 48000.0,
      "variance_dollars": 4300.0,
      "variance_percent": 8.96,
      "is_material": false,
      "signal": "Watch",
      "prior_period": 47100.0,
      "mom_change_dollars": 5200.0,
      "mom_change_percent": 11.04
    },
    {
      "account_code": "5200",
      "account_name": "Third-Party API Costs",
      "category": "COGS",
      "actual": 8900.0,
      "budget": 7500.0,
      "variance_dollars": 1400.0,
      "variance_percent": 18.67,
      "is_material": true,
      "signal": "Unfavorable",
      "prior_period": 7200.0,
      "mom_change_dollars": 1700.0,
      "mom_change_percent": 23.61
    },
    {
      "account_code": "5300",
      "account_name": "Customer Support Team",
      "category": "COGS",
      "actual": 28500.0,
      "budget": 30000.0,
      "variance_dollars": -1500.0,
      "variance_percent": -5.0,
      "is_material": false,
      "signal": "Favorable",
      "prior_period": 28500.0,
      "mom_change_dollars": 0.0,
      "mom_change_percent": 0.0
    },
    {
      "account_code": "6100",
      "account_name": "Engineering Salaries",
      "category": "Operating Expenses",
      "actual": 142000.0,
      "budget": 148000.0,
      "variance_dollars": -6000.0,
      "variance_percent": -4.05,
      "is_material": true,
      "signal": "Favorable",
      "prior_period": 142000.0,
      "mom_change_dollars": 0.0,
      "mom_change_percent": 0.0
    },
    {
      "account_code": "6110",
      "account_name": "Engineering Contractors",
      "category": "Operating Expenses",
      "actual": 18500.0,
      "budget": 12000.0,
      "variance_dollars": 6500.0,
      "variance_percent": 54.17,
      "is_material": true,
      "signal": "Unfavorable",
      "prior_period": 9500.0,
      "mom_change_dollars": 9000.0,
      "mom_change_percent": 94.74
    },
    {
      "account_code": "6200",
      "account_name": "Sales & Marketing Salaries",
      "category": "Operating Expenses",
      "actual": 68000.0,
      "budget": 68000.0,
      "variance_dollars": 0.0,
      "variance_percent": 0.0,
      "is_material": false,
      "signal": "On plan",
      "prior_period": 62000.0,
      "mom_change_dollars": 6000.0,
      "mom_change_percent": 9.68
    },
    {
      "account_code": "6210",
      "account_name": "Paid Advertising",
      "category": "Operating Expenses",
      "actual": 15200.0,
      "budget": 20000.0,
      "variance_dollars": -4800.0,
      "variance_percent": -24.0,
      "is_material": true,
      "signal": "Favorable",
      "prior_period": 18700.0,
      "mom_change_dollars": -3500.0,
      "mom_change_percent": -18.72
    },
    {
      "account_code": "6220",
      "account_name": "Events & Sponsorships",
      "category": "Operating Expenses",
      "actual": 4800.0,
      "budget": 3000.0,
      "variance_dollars": 1800.0,
      "variance_percent": 60.0,
      "is_material": true,
      "signal": "Unfavorable",
      "prior_period": 1200.0,
      "mom_change_dollars": 3600.0,
      "mom_change_percent": 300.0
    },
    {
      "account_code": "6300",
      "account_name": "G&A Salaries",
      "category": "Operating Expenses",
      "actual": 52000.0,
      "budget": 52000.0,
      "variance_dollars": 0.0,
      "variance_percent": 0.0,
      "is_material": false,
      "signal": "On plan",
      "prior_period": 52000.0,
      "mom_change_dollars": 0.0,
      "mom_change_percent": 0.0
    },
    {
      "account_code": "6310",
      "account_name": "Legal & Professional Fees",
      "category": "Operating Expenses",
      "actual": 11200.0,
      "budget": 6000.0,
      "variance_dollars": 5200.0,
      "variance_percent": 86.67,
      "is_material": true,
      "signal": "Unfavorable",
      "prior_period": 5800.0,
      "mom_change_dollars": 5400.0,
      "mom_change_percent": 93.1
    },
    {
      "account_code": "6320",
      "account_name": "Software & Tools",
      "category": "Operating Expenses",
      "actual": 14300.0,
      "budget": 13000.0,
      "variance_dollars": 1300.0,
      "variance_percent": 10.0,
      "is_material": false,
      "signal": "Watch",
      "prior_period": 12800.0,
      "mom_change_dollars": 1500.0,
      "mom_change_percent": 11.72
    },
    {
      "account_code": "6330",
      "account_name": "Office & Facilities",
      "category": "Operating Expenses",
      "actual": 8200.0,
      "budget": 8500.0,
      "variance_dollars": -300.0,
      "variance_percent": -3.53,
      "is_material": false,
      "signal": "Favorable",
      "prior_period": 8200.0,
      "mom_change_dollars": 0.0,
      "mom_change_percent": 0.0
    },
    {
      "account_code": "6340",
      "account_name": "Insurance",
      "category": "Operating Expenses",
      "actual": 3100.0,
      "budget": 3000.0,
      "variance_dollars": 100.0,
      "variance_percent": 3.33,
      "is_material": false,
      "signal": "Watch",
      "prior_period": 3000.0,
      "mom_change_dollars": 100.0,
      "mom_change_percent": 3.33
    },
    {
      "account_code": "6400",
      "account_name": "Travel & Entertainment",
      "category": "Operating Expenses",
      "actual": 6700.0,
      "budget": 5000.0,
      "variance_dollars": 1700.0,
      "variance_percent": 34.0,
      "is_material": true,
      "signal": "Unfavorable",
      "prior_period": 3900.0,
      "mom_change_dollars": 2800.0,
      "mom_change_percent": 71.79
    },
    {
      "account_code": "6500",
      "account_name": "Recruiting & Hiring",
      "category": "Operating Expenses",
      "actual": 8400.0,
      "budget": 4000.0,
      "variance_dollars": 4400.0,
      "variance_percent": 110.0,
      "is_material": true,
      "signal": "Unfavorable",
      "prior_period": 2100.0,
      "mom_change_dollars": 6300.0,
      "mom_change_percent": 300.0
    }
  ],
  "computation_metadata": {
    "period": "2026-02",
    "row_count": 18,
    "material_items": 11,
    "materiality_threshold_dollars": 5000,
    "materiality_threshold_percent": 10,
    "has_prior_period": true,
    "computed_at": "2026-03-12T21:25:13Z"
  },
  "customer_notes": null
}
